{
  "schema_version": "1.0.0",
  "feed_id": "trade_flows",
  "last_updated": "2026-10-29T13:46:23+09:00",
  "source": {
    "label": "UN Comtrade",
    "url": "https://comtradeplus.un.org/",
    "license": "UN data usage policy",
    "disclaimer_ja": "本ページの数値は公開統計の二次加工です。投資・経営判断は自己責任でお願いします。"
  },
  "meta": {
    "reporter": {
      "iso2": "JP",
      "iso3": "JPN",
      "name_ja": "日本"
    },
    "partners": [
      {
        "iso2": "VN",
        "name_ja": "ベトナム",
        "name_en": "Vietnam"
      },
      {
        "iso2": "TH",
        "name_ja": "タイ",
        "name_en": "Thailand"
      },
      {
        "iso2": "CN",
        "name_ja": "中国",
        "name_en": "China"
      },
      {
        "iso2": "IN",
        "name_ja": "インド",
        "name_en": "India"
      },
      {
        "iso2": "ID",
        "name_ja": "インドネシア",
        "name_en": "Indonesia"
      },
      {
        "iso2": "PH",
        "name_ja": "フィリピン",
        "name_en": "Philippines"
      },
      {
        "iso2": "MY",
        "name_ja": "マレーシア",
        "name_en": "Malaysia"
      },
      {
        "iso2": "SG",
        "name_ja": "シンガポール",
        "name_en": "Singapore"
      },
      {
        "iso2": "KR",
        "name_ja": "韓国",
        "name_en": "Korea"
      },
      {
        "iso2": "HK",
        "name_ja": "香港",
        "name_en": "Hong Kong SAR"
      },
      {
        "iso2": "AE",
        "name_ja": "UAE",
        "name_en": "United Arab Emirates"
      },
      {
        "iso2": "SA",
        "name_ja": "サウジアラビア",
        "name_en": "Saudi Arabia"
      },
      {
        "iso2": "TR",
        "name_ja": "トルコ",
        "name_en": "Turkiye"
      },
      {
        "iso2": "GB",
        "name_ja": "英国",
        "name_en": "United Kingdom"
      },
      {
        "iso2": "DE",
        "name_ja": "ドイツ",
        "name_en": "Germany"
      },
      {
        "iso2": "FR",
        "name_ja": "フランス",
        "name_en": "France"
      },
      {
        "iso2": "US",
        "name_ja": "米国",
        "name_en": "United States"
      },
      {
        "iso2": "CA",
        "name_ja": "カナダ",
        "name_en": "Canada"
      },
      {
        "iso2": "BR",
        "name_ja": "ブラジル",
        "name_en": "Brazil"
      },
      {
        "iso2": "TW",
        "name_ja": "台湾",
        "name_en": "Taiwan"
      }
    ],
    "hs_codes": [
      {
        "hs": "22",
        "name_ja": "飲料・アルコール・酢",
        "name_en": "Beverages"
      },
      {
        "hs": "33",
        "name_ja": "精油・香料・化粧品",
        "name_en": "Essential oils / cosmetics"
      },
      {
        "hs": "84",
        "name_ja": "機械類",
        "name_en": "Machinery"
      }
    ],
    "year_coverage": {
      "from": 2022,
      "to": 2024
    },
    "metric_ids": [
      "trade.export.value_usd",
      "trade.import.value_usd"
    ],
    "row_count": 162
  },
  "modules": {
    "E3_trade_flows": {
      "module_id": "E3",
      "title_ja": "日本の品目別・相手国別 貿易フロー",
      "title_en": "Japan trade flows by HS and partner",
      "last_updated": "2026-10-29T13:46:23+09:00",
      "source": {
        "label": "UN Comtrade API",
        "url": "https://comtradedeveloper.un.org/"
      },
      "flows": [
        {
          "partner_iso2": "AE",
          "partner_name_ja": "UAE",
          "hs": "22",
          "hs_name_ja": "飲料・アルコール・酢",
          "flow": "X",
          "year": 2022,
          "value_usd": 16117968.79,
          "metric_id": "trade.export.value_usd",
          "veritas": "✅"
        },
        {
          "partner_iso2": "AE",
          "partner_name_ja": "UAE",
          "hs": "33",
          "hs_name_ja": "精油・香料・化粧品",
          "flow": "X",
          "year": 2022,
          "value_usd": 14075985.61,
          "metric_id": "trade.export.value_usd",
          "veritas": "✅"
        },
        {
          "partner_iso2": "AE",
          "partner_name_ja": "UAE",
          "hs": "84",
          "hs_name_ja": "機械類",
          "flow": "X",
          "year": 2022,
          "value_usd": 1365941502.08,
          "metric_id": "trade.export.value_usd",
          "veritas": "✅"
        },
        {
          "partner_iso2": "BR",
          "partner_name_ja": "ブラジル",
          "hs": "22",
          "hs_name_ja": "飲料・アルコール・酢",
          "flow": "X",
          "year": 2022,
          "value_usd": 1397981.7,
          "metric_id": "trade.export.value_usd",
          "veritas": "✅"
        },
        {
          "partner_iso2": "BR",
          "partner_name_ja": "ブラジル",
          "hs": "33",
          "hs_name_ja": "精油・香料・化粧品",
          "flow": "X",
          "year": 2022,
          "value_usd": 1766504.0,
          "metric_id": "trade.export.value_usd",
          "veritas": "✅"
        },
        {
          "partner_iso2": "BR",
          "partner_name_ja": "ブラジル",
          "hs": "84",
          "hs_name_ja": "機械類",
          "flow": "X",
          "year": 2022,
          "value_usd": 998729250.38,
          "metric_id": "trade.export.value_usd",
          "veritas": "✅"
        },
        {
          "partner_iso2": "CA",
          "partner_name_ja": "カナダ",
          "hs": "22",
          "hs_name_ja": "飲料・アルコール・酢",
          "flow": "X",
          "year": 2022,
          "value_usd": 23627717.3,
          "metric_id": "trade.export.value_usd",
          "veritas": "✅"
        },
        {
          "partner_iso2": "CA",
          "partner_name_ja": "カナダ",
          "hs": "33",
          "hs_name_ja": "精油・香料・化粧品",
          "flow": "X",
          "year": 2022,
          "value_usd": 26625250.07,
          "metric_id": "trade.export.value_usd",
          "veritas": "✅"
        },
        {
          "partner_iso2": "CA",
          "partner_name_ja": "カナダ",
          "hs": "84",
          "hs_name_ja": "機械類",
          "flow": "X",
          "year": 2022,
          "value_usd": 1194210311.78,
          "metric_id": "trade.export.value_usd",
          "veritas": "✅"
        },
        {
          "partner_iso2": "CN",
          "partner_name_ja": "中国",
          "hs": "22",
          "hs_name_ja": "飲料・アルコール・酢",
          "flow": "X",
          "year": 2022,
          "value_usd": 397503393.78,
          "metric_id": "trade.export.value_usd",
          "veritas": "✅"
        },
        {
          "partner_iso2": "CN",
          "partner_name_ja": "中国",
          "hs": "33",
          "hs_name_ja": "精油・香料・化粧品",
          "flow": "X",
          "year": 2022,
          "value_usd": 2881354488.84,
          "metric_id": "trade.export.value_usd",
          "veritas": "✅"
        },
        {
          "partner_iso2": "CN",
          "partner_name_ja": "中国",
          "hs": "84",
          "hs_name_ja": "機械類",
          "flow": "X",
          "year": 2022,
          "value_usd": 30942009967.02,
          "metric_id": "trade.export.value_usd",
          "veritas": "✅"
        },
        {
          "partner_iso2": "DE",
          "partner_name_ja": "ドイツ",
          "hs": "22",
          "hs_name_ja": "飲料・アルコール・酢",
          "flow": "X",
          "year": 2022,
          "value_usd": 7389237.3,
          "metric_id": "trade.export.value_usd",
          "veritas": "✅"
        },
        {
          "partner_iso2": "DE",
          "partner_name_ja": "ドイツ",
          "hs": "33",
          "hs_name_ja": "精油・香料・化粧品",
          "flow": "X",
          "year": 2022,
          "value_usd": 50918452.03,
          "metric_id": "trade.export.value_usd",
          "veritas": "✅"
        },
        {
          "partner_iso2": "DE",
          "partner_name_ja": "ドイツ",
          "hs": "84",
          "hs_name_ja": "機械類",
          "flow": "X",
          "year": 2022,
          "value_usd": 3609698990.13,
          "metric_id": "trade.export.value_usd",
          "veritas": "✅"
        },
        {
          "partner_iso2": "GB",
          "partner_name_ja": "英国",
          "hs": "22",
          "hs_name_ja": "飲料・アルコール・酢",
          "flow": "X",
          "year": 2022,
          "value_usd": 20954789.86,
          "metric_id": "trade.export.value_usd",
          "veritas": "✅"
        },
        {
          "partner_iso2": "GB",
          "partner_name_ja": "英国",
          "hs": "33",
          "hs_name_ja": "精油・香料・化粧品",
          "flow": "X",
          "year": 2022,
          "value_usd": 16288518.72,
          "metric_id": "trade.export.value_usd",
          "veritas": "✅"
        },
        {
          "partner_iso2": "GB",
          "partner_name_ja": "英国",
          "hs": "84",
          "hs_name_ja": "機械類",
          "flow": "X",
          "year": 2022,
          "value_usd": 2180545683.92,
          "metric_id": "trade.export.value_usd",
          "veritas": "✅"
        },
        {
          "partner_iso2": "HK",
          "partner_name_ja": "香港",
          "hs": "22",
          "hs_name_ja": "飲料・アルコール・酢",
          "flow": "X",
          "year": 2022,
          "value_usd": 135151738.99,
          "metric_id": "trade.export.value_usd",
          "veritas": "✅"
        },
        {
          "partner_iso2": "HK",
          "partner_name_ja": "香港",
          "hs": "33",
          "hs_name_ja": "精油・香料・化粧品",
          "flow": "X",
          "year": 2022,
          "value_usd": 789644575.04,
          "metric_id": "trade.export.value_usd",
          "veritas": "✅"
        },
        {
          "partner_iso2": "HK",
          "partner_name_ja": "香港",
          "hs": "84",
          "hs_name_ja": "機械類",
          "flow": "X",
          "year": 2022,
          "value_usd": 1559400489.33,
          "metric_id": "trade.export.value_usd",
          "veritas": "✅"
        },
        {
          "partner_iso2": "ID",
          "partner_name_ja": "インドネシア",
          "hs": "22",
          "hs_name_ja": "飲料・アルコール・酢",
          "flow": "X",
          "year": 2022,
          "value_usd": 3565305.04,
          "metric_id": "trade.export.value_usd",
          "veritas": "✅"
        },
        {
          "partner_iso2": "ID",
          "partner_name_ja": "インドネシア",
          "hs": "33",